restaurant_name,category,business_hours,tags,restaurant_info,restaurant_facility,restaurant_introduction,total_reviews,overall_rating,menu_info,all_reviews,review_match
월드컵흑돼지,"육류,고기",매일10:00 ~ 22:00,"#안심식당, #친목모임, #회식장소, #제로페이, 더보기",정보 없음,주차,정보 없음,49,4.2점,"명:월드컵 스페셜, 가격: 38,000흑돼지 오겹, 전복, 된장찌개, 수제소세지, 후식냉면 (2인이상 주문가능) | 명:흑돼지 오겹살, 가격: 22,000 | 명:흑돼지 목살, 가격: 22,000 | 명:제주산 오겹살, 가격: 16,000 | 명:제주산 목살, 가격: 16,000 | 명:전복갈비탕, 가격: 20,000","2024.05.02.:  | 2023.08.04.: 가족8인 픽업서비스로 맛나고 즐거운 좋은추억 완성 | 2023.08.01.: 숙소로 픽업해서 식사하고 숙소까지 다시 턴해주시고..흑돼지도 맛있고 사장님도 너무너무 친절하십니다. 다시 방문하고 싶을 정도로.. 지인에게 꼭 소개하고 싶은 맛집입니다~ | 2023.06.26.: 카카오리뷰도 알바가 많이 생겨 믿을게 못될거같네요 | 2023.05.09.: 전복이랑 고사리랑 다양하게 먹을 수 있어서 좋았고 소스 그게 참 별미입니다!!! | 2023.03.10.:  | 2023.02.23.: 소스개발에만 5천만원 들어간 흑돼지집：대한항공 승무원이 추천해준, 제주도 찐맛집 20곳 | 2023.02.20.: 흑돼지 진짜 좋아하는데 제가 먹었던 흑돼지중에 손에꼽힐정도로 여기 엄청 맛있네요 여기서 먹길 아주 잘한거같습니다 | 2023.02.14.: 신선한 제주도산 돼지를 사용하니 고기 육질이 참 훌륭해요. 음미하며 먹으니 더욱 맛있습니다 | 2023.02.13.: 흑돼지 맛집이네요. 상당히 부드럽고 맛이 깔끔합니다 좋았어요 | 2023.01.30.: 흑돼지에 소주는 국룰입니다...... 평소 주량보다 더 잘들어가면서도 덜 취해요 너무 맛있음 | 2023.01.26.: 사실 흑돼지가 뭐 특별해? 라고 생각했는데 맛있어요. 뭔가 더 감질맛이 난달까? 전 좋았네요 | 2023.01.25.: 갈비탕 국물도 구수하고 고기양도 많아서 배터지게 잘먹었어요 추천 | 2023.01.19.: 내가.. 여길 왜 갔지?추천 받아서 갔는데 반찬은 싱싱하지도 않고 냉면도 성의 없는 구성에 메인인 흑돼지는 그냥 쫄깃하기만 하고 아무 맛도 안 납니다 그냥 집에서 삼겹살 구워먹는 게 더 맛있어요 아무래도 5점짜리 댓글은 알바가 아닌지,, 다음날 다른 흑돼지 식당 가서 치유받고 옴제주 여행에서 흑돼지를 경험하고 싶다면 다른 곳으로 가시길! | 2023.01.18.: 월드컵 스페셜 메뉴로 먹었는데. 상당히 양도 만족스러웠고 식감이 참 깔끔했네요. 좋은 흑돼지 쓰시는 것 같아서 잘 먹었습니다 | 2023.01.17.: 여기는 고기를 진짜 육질 좋은 고기들로만 쓰는 게 식감에서 부터 느껴지네요. 그만큼 보장된 맛입니다. 자주 가서 먹는데 또 가고 싶어요 | 2023.01.16.: 흑돼지 특유의 식감이 살아 있어요. 별미로 즐기는 편인데도 그 맛을 잊기가 참 힘들정도로 맛 있습니다. | 2023.01.10.: 흑돼지 퀄리티 최고 👍 실내 인테리어도 깔끔했고 기본 상차림 잘 나오네요 제주도 여행에서 찐으로 먹고 왔어요 | 2023.01.09.: 고기양 푸짐하고 깔끔해서 고기먹기 너무 좋은 곳.서비스도 좋으시고 친절하시네요 ㅎㅎ | 2023.01.04.: 두툼한고기 좋아하는데 여긴 고기도 두툼하고 잡내도 없어서 맛잇게 먹고왔어요 기본 찬들도 깔끔하니 정갈하게 나와서 이걱저것 같이 곁들여먹었네용 잘먹었습니당 | 2023.01.03.: 흑돼지 싱싱하고 두툼하네요 육질 부드럽고 맛있었어요 역시 제주하면 흑돼지ㅎ 곁들여먹는 반찬들도 궁합 최고 좋았어요 | 2022.12.27.: 친절한 사장님, 고기 맛도 좋구 밑반찬도 정갈하게 잘나오네요다음에 또 올께요 | 2022.12.27.: 제주는 현지인믿고가는 맛집👍 야들야들 쫄깃쫄깃 육즙팡 ㅠㅠㅠ 왜 흑돼지흑돼지 하는지 알것같아여 핵존맛 | 2022.12.20.: 흑돼지 역시 다르네요 육질도 쫀쫀하고 맛있네요 기본찬들도 고기와 너무 잘어울리고 맛있었어요 | 2022.12.19.: 흑돼지 육즙과 육질이 그대로 살아있는 집이네요너무 맛있게 잘 먹었습니당 | 2022.12.14.: 제주도 여행 왔으면 흑돼지는 필수죠ㅋㅋ고가 두툼하고 실하고 육즙이 미쳤음! 배 터지게 먹고왔내요 내부도 청결하고 직원분들도 친절해서 기분 좋게 먹고왔어요 ㅋㅋ | 2022.12.13.: 제주에서 재대로 맛본 흑돼지 였어요 일반 돼지고기보다 육질 쫀쫀하고 더 담백 고기 퀄리티 좋았고 전보과 함께 먹으니 이것도 꿀조합이네요 | 2022.11.08.: 흑돼지 너무 맛있게 먹고 왔어요~ 매장도 깔끔하고 사장님도 친절 하시고 무엇보다 고기 질도 좋고 반찬도 잘 나와요!! | 2022.11.07.: 제대로된 흑돼지를 먹어보네요. 육질이 쫄깃 탱탱 식감이 최곱니다. 밑반찬도 정갈하구요! 2명이서 3인분 클러어했어요ㅋㅋ 후식배는 따로있나봐요 고기먹고 밥으로 마무리! | 2022.11.01.: 법환쪽에서 저녁 먹을곳 찾다가 흑돼지 땡겨서 먹었습니다. 애들 데리고갔는데 사장님 넘 친절하셔서 만족했고 맛도 반찬도 훌륭했어요! 다음엔 전복 추가해서 먹어볼게요^^ | 2022.10.31.: 흑돼지 진짜 좋아하는데 맛있게 잘 먹었습니다! 육지랑은 차원이 다른 맛😁 | 2022.10.25.: 두꺼운 흑돼지에 좋아라 하는 전복에반찬들도 맛나고친절하고 고기 맛 좋아 넘 좋아요 | 2022.10.24.: 제주에서 제대로 흑돼지 먹은 듯 해요 ㅎ 불판 세팅 너무 좋네요 흑돼지 육즙 살아있고 부드럽고 신선하네요 전복과 야채 너무 좋았어요 ^^ | 2022.10.18.: 제주에서 흑돼지는 필수.. 육즙이 꽉 담겨져 더 맛있게 즐겼어요~ 친절히 안내해주셔서 감사했어요! | 2022.10.18.: 제주 흑돼지 맛집 ^^ 즐겁게먹고갑니다 육즙최고 | 2022.10.14.: 여러조합으로 먹을수 있어서 더 좋았던 곳이예요.놀러간 제주도에서 진짜 잘 찾아간 집중 하나인것 같아서 꼭 가보시길~~ 오겹살구이 굳굳 | 2022.10.13.: 사장님도 친절하시고 맛있어서 잘 먹고 갑니다 ㅎ 오겹살 맛집이에요 | 2022.09.24.:  | 2022.04.17.: 식당 장소도 넓고 직원들이 친절하긴하나 제주 여행 12일째 흙돼지 먹어본 고기중 가장 맛이 적었네요.추천하고싶지 않은 곳입니다. | 2021.12.20.: 여기 맛있는데 평가 왜이러죠??ㅠ 저도 단체 손니 받는 그런덴줄 알았는데 제주 와서 먹었던집 중 가장 맛있네요ㅎ 현지인 많이 가는 그런데 있음 알러주세요ㅎ 흑돼지 맛나구요 음식 하나 반찬 하나 다 ""정성""담긴 음식이네요ㅎ 미리 연락주심 근처는 픽업&드랍도 해주십니다 잘 먹고 갑니다 사장님 | 2021.11.08.: 실망 실망 대실망 입니다... | 2021.05.30.: 현지인은 절대 안 가는 곳 | 2021.05.04.: 세상에서 가장 맛있는 흑돼지..이렇게 부드럽고 담백한 흑돼지 없습니다.. | 2020.10.06.: 갈비탕 먹었는데 최악입니다. 얼마나 오래됐는지 쉰내나는 밥, 고기는 뼈에서 잘 발라지는데 질기고 잡내나고.... 가게 안에 파리가 몇마리가 날아다니는지... 차라리 근처 맥도날드나 갈 걸 그랬어요. | 2020.09.26.: 맛난 오삼겹, 싱싱한 전복과 푸짐한 야채, 손수 만드신 소시지, 어머니가 끓여주신 듯한 된장찌게, 입에 촥 감기는 냉면 그리고 바쁘신 와중에도 주인 아주머니께서 직접 구워주셔서 가족이 함께 음미하며 맛나게 먹었습니다,물론 음료수 서비스 감사했습니다.식사를 마치고, 정성들여 가꾸신 야자수, 조명을 배경으로 한 컷다음에 다시 제주 방문하게 되면 꼭 들러야 할 곳으로 강추합니다.^^ | 2020.09.21.: 흑돼지, 전복, 소시지 한꺼번에 맛있게 먹을 수 있습니다밑반찬도 훌륭했고 된장찌개도 맛있었어요식당 넓고 인테리어 잘 되어 있고 깨끗합니다 | 2020.01.01.: 탕을 먹었으나 고기를 먹으러 오고 싶다는 생각이 들지는 않음",일치
긱스타 앤 빽다방,"게임방,PC방",매일00:00 ~ 24:00,"#카카오페이, 더보기",정보 없음,정보 없음,정보 없음,6,3.8점,정보 없음,2023.07.28.: 가격도 착하고 경치가 정말 이쁜 곳이었습니다. | 2023.07.23.: 카카오페이 여러가지 결제기능 지원되서 넘 좋고 직원분들도 너무 친절함 !! 심지어 음식도 잘 나옴 !! | 2023.07.02.: 처음 생길때는 깔끔하고 좋았는데청소안하시는지 더러워요그리고 여름인데 에어컨은 왜 시원하게 안트시나요. 컴퓨터 앞에 앉아 있으면 열기 때문에 뜨거워요. | 2023.01.16.: 피시방+ 카페.. 굉장히 좋음.. 자리에서 카카오페이 결제가능 음식 다양하고 맛있음다만 알바가 너무 바빠보여서 조금 안타깝... | 2022.11.12.: 카페로서 테이크아웃 이용해보고 피시방으로 이용해봤는데 카페로서는 좋습니다! 근처에 카페가 별로없어서 빽다방 이용할수있는게 너무편리해요. 다만 피시방으로서는 모르겠어요.. 올해초에 생긴것 치고는 컴퓨터 잔렉이 있고 청결은 최악인듯 합니다. 키보드 마우스 책상 안닦습니다. 먼지가 쌓여있고 실제로 알바생들 자리치울때 닦는거 본적없습니다. | 2022.08.15.: 빽다방 콜라보에 위치 아주 좋습니다,일치
리치망고도두해안로점,생과일전문점,매일10:00 ~ 20:30,"#제로페이, 더보기",정보 없음,주차,정보 없음,25,3.6점,"명:에스프레소 (HOT), 가격: 3,500 | 명:아메리카노 (HOT), 가격: 5,000 | 명:카페라떼 (HOT), 가격: 5,000 | 명:카라멜라떼 (HOT), 가격: 5,500 | 명:모카라떼 (HOT), 가격: 5,500 | 명:바닐라라떼 (HOT), 가격: 5,500 | 명:망고라떼 (HOT), 가격: 5,500 | 명:카푸치노 (HOT), 가격: 5,000 | 명:올인원망고쉐이크(ICE), 가격: 9,900 | 명:프리미엄애플망고쉐이크(ICE), 가격: 9,500 | 명:코코넛애플망고쉐이크(ICE), 가격: 8,500 | 명:스페셜망고쉐이크(ICE), 가격: 8,000 | 명:망고라쉬(ICE), 가격: 6,500 | 명:망고밀크쉐이크(ICE), 가격: 6,500 | 명:블루베리밀크쉐이크(ICE), 가격: 6,500 | 명:딸기밀크쉐이크(ICE), 가격: 7,500 | 명:파인애플밀크쉐이크(ICE), 가격: 6,500 | 명:바나나피넛밀크쉐이크(ICE), 가격: 6,500 | 명:한라봉쉐이크(ICE), 가격: 6,500 | 명:레몬에이드(ICE), 가격: 6,000 | 명:패션후르츠티 (HOT), 가격: 4,500 | 명:유자에이드(ICE), 가격: 6,000 | 명:한라봉에이드(ICE), 가격: 6,000 | 명:자몽에이드(ICE), 가격: 6,000 | 명:자몽차, 가격: 4,500 | 명:레몬차, 가격: 4,500 | 명:매실차, 가격: 4,500 | 명:한라봉차, 가격: 4,500 | 명:유자차, 가격: 4,500 | 명:바닐라 엔젤라또, 가격: 6,000 | 명:다크초코 엔젤라또, 가격: 6,000 | 명:망고 엔젤라또, 가격: 6,000 | 명:흑임자 엔젤라또, 가격: 6,000 | 명:딸기 엔젤라또, 가격: 6,000 | 명:요거트 엔젤라또, 가격: 6,000 | 명:라코타치즈 엔젤라또, 가격: 6,000 | 명:녹차 엔젤라또, 가격: 6,000",2024.09.02.: 절대가지마세요.... 공항에서 가깝고 리치망고 체인이길래 갔는데 편의점 망고주스가 더 맛있을지경임 살면서 먹어본 망고중에 최악임결혼식싸구려뷔페 냉동망고가 더 맛있으니 돈날리지말고 리뷰 꼭 보세요... | 2024.07.31.: 망고 별로 안 좋아했는데 망고나 애플망고가 맛있단 생각을 여기서 처음 했어요! 그리고 사장님 너무 멋있으심. 왕언니 느낌. 여자 혼자 차도 없이 타지로 여행 왔냐고 걱정하시더니 온갖 꿀팁 대방출 해주심. 이날 이전까지 망고 종류는 입가에도 잘 안 대려 했던 저는 마음 속으로 리치망고 도두해안로점에 충성을 맹세했습니다. 앞으로 남은 이틀 동안 이 근처에서 목이 마를 때면 여기 음료만 마시겠다고. 근데 정말 맛있었어요. | 2024.07.07.: 리치망고도 가게마다 맛이 다를 수 있지...아쉽더라 | 2023.09.28.: 왜 망고쉐이크가 우리집 냉동실에있는 아이스홍시 맛이 나죠 | 2023.09.26.: 애플망고 망고 통째로 먹는 느낌 맛있었어요 9월이여도 한낮은 너무 더운데 더위싹날아가는 맛 굿굿 | 2023.09.12.: I'll probably be back like every day of my stay. This was so good. Like eating a mango but colder and easier and no mess and perfectly ripe 🥭🥭🥭Super cute too. | 2023.08.04.: 망고도 한라봉 주스도 맛있었어요! | 2023.07.13.: 너무 친절하고 맛도 좋고!! 더위 잘 식히다갔어요! | 2023.06.09.: 맛이 없을수 없지.숙소 근처에 있어서 공항 가기 전 테이크 아웃으로 데려감:) | 2022.09.18.: 넘 맛있는 리치망고 ㅜㅜ 마지막날 차타고 지나가다가 보여서 급 방문했어요! 쉐이크 넘 맛났구 여자사장님 친절하셔서 넘 좋았어요 | 2022.09.04.: 후기보고 덜덜~ 하면서 갔는데 여자 사장님 계셨어요! 너무너무 친절하고 메뉴 설명도 잘해주셨어요. 역시 후기보다는 직접 가봐야 알 수 있는듯...ㅋㅋ | 2022.06.26.: 꾸준한 맛! | 2022.05.31.: 저는 너무 맛있었어요… 망고도 찐하고 | 2022.03.02.: 후기를 봤어야했는데...함덕점 가려다가 가까운 곳에 리치망고 있길래 들어갔다가 기분만 상했네메뉴 차이 물어볼라하니까 바로 말 끊고 옆에 현수막에 다 있어요 이러면서 건성으로 응대하고두병 사면서 내일 먹어도 되냐 물어보니 자긴 그렇게 안먹어봐서 모르겠다 이러고;;다 오픈된 공간인 계산대에 앉아서 마스크 벗고 있음 | 2022.01.02.: 1점도 아까움. 카운터 남자 사장인지 알바인지 절레절레.. 둘중 어느 직책이어도 큰 문제 아닌가요? 성질 내놓고 안 그런척 하하 웃는데 소름. 살면서 계산하는데 상대방이 언성 높인적 처음이에요. 하물며 카페에서! 짜증내지 말고 차분히 설명을 하세요^^ 포인트 적립말고 계산 먼저 해야됩니다. 이 말이 어렵나요? 카드 확 가져가 폰 확 가져가 어휴... 남자라서 그런가 전에 있던 여자 직원은 무척 친절하시던데 ㅉㅉ | 2021.12.24.: 너무 퉁명스러워서 음료까지 맛없어져요.부디 다른 지점 가세요! | 2021.11.26.: 진짜 카운터 ㅋㅋㅋㅋ사장이면 배짱이고 직원이면 짤라라 | 2021.05.03.: 사장님 친절하시구 밑에 불친절하다는건 좀 이해안가요 친절하시구 맛있게 해주셔서 또 오고싶어요 | 2021.03.09.: 직원인지 사장인지 손님바로앞에 있는데 다들리게 귀찮다는듯이 한숨쉬고 개념이있는건지ㅋㅋ그따구로 장사하지마세요잇장사할거면 개념부터 챙기고^^정신교육도 좀 받고^^ | 2020.11.27.: 제주 갈때 종종 들르게 되는곳~도두봉 오르기전 한라산 풍경바라보며차한잔하며 잠시 쉬어가기 좋은곳입니당~ | 2020.10.27.: 애플망고랑 망고쉐이크 먹었는데 맛있었어요 | 2020.08.30.: 더운 여름날 중간에 사진도찍고 간단하게 망고쥬스한잔하기 좋은곳! | 2020.08.05.: 상당히 괜찮았습니다! 오시면 크로크무슈 먹어보세요 차가운 망고가 올려져 있답니다ㅎㅎ,일치
메가엠지씨커피 제주노형점,메가MGC커피,월~토08:00 ~ 21:30,"#카카오페이, #제로페이, 더보기","예약불가, 배달가능, 포장가능","WIFI, 동물출입금지, 주차, 휠체어사용없음, 놀이방시설 없음, 흡연실시설 없음",정보 없음,11,3.8점,"명:ICE 아메리카노, 가격: 2,000 | 명:HOT아메리카노, 가격: 1,500 | 명:메가리카노, 가격: 3,000","2024.09.28.: 가성비좋고 맛있어서 학교 끝나고 자주 감냠냠굿 | 2024.09.24.: 항상 친절하게 응대해주시고, 헬스장 가기 전 카페인 보충하러 종종 갑니다:) | 2024.06.20.:  | 2023.09.15.: 요즘 맨날 20분 기다려주세요 그러네 ㅠ ㅠ | 2022.09.20.:  | 2021.10.01.: 어머 이거 뭐래여?!! 양이 일단 이름 그대로 메가사이즈~ 배가 벌떡! 지인이 사다준 곡물라떼랑 로얄밀크티! 쫀득거리는 무엇!!! 모두 많이 달지 않고, 핵존맛! 존맛탱! 세상에 가까운 곳에~!!!! 자주 갈께요~ 쌩유배리감사! | 2021.09.27.: 크로플을 먹어봤는데 충분히 쫀득하고 부드러워요! | 2021.09.19.: 크로플은 쫀득함이 없이 눅눅하기만 하고, 딸기라떼는 완전 밍밍하고 맛도 없네요. 케이크도 완전 별로. 저가형 카페라고해서 다른 카페만큼의 퀄리티를 바라지는 않지만 어느정도 기본이 있어야 한다고 생각합니다. 기본도 안되어있네요. | 2021.06.24.: 별 한개도 아깝네요. 저녁 9시경에 친구들과 커피한잔 하러 갔는데 여자 알바분 정말....써비스 최악..들어갈때 인사는 커녕. 과일류는 안되요.! 하더니 키오스?그거 저희 잘 모르고 주문할려하니 밖에 나가서 보시고 하라고!그래서 나가서 차근차근 주문하고 커피 나올때까지 안에서 기다리는데 컵에 얼음 붇는 소리에 벌써 짜증이 한가득. 알마뒤에 커피가 나왔는데 알바실수로 음료 하나가 잘못 나왔는데 죄송하다는 말은 한마디 없고 다시 해드릴께요. 딱 한마디. 그러고 한명은 커피 못마시고 기다리고 있었는데.. 한참 지나서 보니 카운터 옆 음료 나오는 곳에 나와있는거에요. 나왔다고 말한마디 안하고. 얼음은 녹아있고...정말 너무 화가나서 한마디 하려는거 친구들이 그냥 참으라고..그렇게 기분 않좋게 다 마시고 나가는데 울 칭구들 그래도~매너있게 잘 먹었어요~~수고 하세요~~라고 다들 한마디씩 하고 나가는데...정말...1도 얼굴한번 안보고 인사한마디 안하더라구요. 진짜.....내 평생 이런 기분나쁜적은 처음...이글 그곳 주인분이 보면 정말..각성하셔야 할듯해요.암튼...두번 다시는 절대 안갑니다. | 2020.08.02.: 손님도 많고 바빠보였는데도 친절하게 응대해주셨어요! 그리고 가성비까지 좋아서 자주 들릴것 같습니다ㅎㅎ | 2020.07.03.: 친절해요, 커피도 맛있어요",일치
20년  전통부대찌개,"찌개,전골","월,화,수,목,금,일11:00 ~ 21:00",정보 없음,정보 없음,주차,정보 없음,26,4.3점,"명:부대찌개, 가격: 9,000 | 명:떡갈비, 가격: 7,000 | 명:열무국수, 가격: 7,000 | 명:열무냉면 (계절메뉴), 가격: 8,000","2024.09.23.: 특별할게 없는 듯 한데 계속 생각남 | 2024.07.07.: 열무국수 디지게 맛있음.근데 양이 적어서 무적권 곱빼기!!에어컨 안 틀어서 너무 더웠음. | 2024.04.14.: 저렴하고 정석적인 부대찌개의 맛👍양이 적지 않아서  배부르게 먹었어요열무가 진짜 맛있음 ㅎㅎ다음에 오면 열무국수 먹을게요 | 2024.01.28.: 부대찌개 2인분 부터맛있게 먹고 왔어요 | 2024.01.22.:  | 2024.01.05.: 부찌 찐하고 존맛!!!!! | 2023.11.12.: 항상 변함없는 맛 유지해 주셔서 감사합니다 30년단골입니다.특히 열무국수는  그 맛이 환사밉니다 | 2023.09.03.:  | 2023.08.26.: 햄사리가 부족한 느낌맛은 무난함 | 2023.06.25.:  | 2023.05.25.:  | 2023.05.18.: 예전보다 맛이 밍밍하지만 그래도 최고 | 2023.05.15.: 칠성로에 있었을 땐, 부대찌개도 맛있었는데 중앙로로 옮기고나선 그냥 저냥 밍밍. 서브인 열무국수는 엄청 맛있어요. 열무국수 때매 재방문 할 거 같아요. | 2023.04.06.:  | 2023.02.22.: 부대찌개 푸짐하게 주시고, 서비스로 주신 전도 맛있고, 밑반찬도 맛있고, 아주 맛있게 잘 먹었습니다 | 2023.02.19.:  | 2023.02.16.: 서비스로 나오는 동치미 김치가 상당히 맛있어요. 부대찌개도 기본에 충실하고 맛있음 ! | 2023.01.19.: 열무를 먹으러 가는 집.부찌도 상타 | 2022.10.07.: 인생 부대찌개 열무 김치랑 열무 국수 부침개 다 맛있어요 | 2022.04.03.: 굳 | 2022.02.20.: 제주도 왔는데 왠 부대찌게?  하지말고  그냥 잡숴봐!   실망하면 당신이 부대찌게를 안좋아 한다는 의미일듯...   어줍지 않은 맛집  찾아 돌아댕기지 말고  힐링 할것~! | 2022.01.04.: 기본으로 나오는 녹두전이랑 동치미국물도 맛있는데메인인 부대찌개는 더 맛있네요. 백점 | 2021.08.29.: 백점!! | 2021.07.04.: 녹두전은 별점 10점 | 2020.05.30.: 문닫음 ㅠㅠ",일치
