restaurant_name,category,business_hours,tags,restaurant_info,restaurant_facility,restaurant_introduction,total_reviews,overall_rating,menu_info,all_reviews,review_match
루스트플레이스구남점,양식,매일11:00 ~ 22:00,"#가족모임, #이동약자접근, #피맥, #카카오페이, #제로페이, 더보기","예약가능, 배달가능, 포장가능","WIFI, 동물출입금지, 주차, 휠체어사용, 놀이방시설 없음, 흡연실시설 없음",정보 없음,11,1.9점,정보 없음,"2023.12.01.: 별점 1점도 아깝습니다.맥주는 3분2만 채워주고 영업시간 11시까지인데 손님이 저희만 있다고 눈치주듯이 수저 채우고 처다보고 영업 몇시까지냐 물아보니 더듬으면서 10시 라고 ... 눈치보여서 9시에 나왔습니다.루스트가 망해가는 이유가 있는듯.. | 2023.02.03.: 일하는 꼬라지가 어느지점 루스트를가도 똑같음매장수만 잔득 늘리고 전혀 관리안하는 느낌 | 2022.10.12.: 아주아주 최악인 루스트4인가족 메뉴4개가 전부 따로나옴마지막 메뉴는 누가봐도 누락되었는데주문이 밀렸다는 말도안되는 핑계로(옆테이블 늦게온테이블 음식 다나옴)15분후에 음식을줌뭘먹었는지 모르겠음절대절대 방문하지마시길 | 2022.07.10.: 루스트중 최악...음식은 다 말라 비틀어지고..볶은밥에선 액젓 냄새나고..다른곳은 다있는 셀프커피바도 없구요.참고로 이집사장님 1층에 커피전문점  하니까 커피는내려와서 따로 사먹으러는 생각인거 같은데..대단하심~ | 2021.12.21.: 최악... 직원들 대응도 최악, 반응도 최악. 아무튼 오늘은 기분이 나쁨을 떠나 모멸감을 느끼게 만들었다. 직원 교육 잘 시키세요. | 2021.09.20.: 그냥 그래요 | 2021.04.09.:  | 2021.03.17.: 진짜... 여기 최악이에요 | 2020.11.19.: 별하나도 아깝습니다 음식나오는것이 오래걸리는 상황이면 주문받을때 미리 말씀을 주셔야죠물어볼때마다 잠시만요 라는 말로만 일괄하고함께 식사하자고 만난자리에서 음실들이 띄엄띄엄 나와서 코스요리 먹는줄 알았습니다""주방에 사람이 한명밖에 없어서요""라는 변명뒤에계산하러 갈때 바라본 주방에 네분이 계시는건 무엇이였을까요? | 2020.10.18.: 그냥그냥 | 2020.08.18.: 에이바우트 2층, 도남로 199",일치
조마루뼈다귀 서귀포점,조마루감자탕,매일00:00 ~ 24:00,"#안심식당, #혼밥, #제로페이, 더보기",정보 없음,주차,정보 없음,14,3.8점,"명: 명:왕새우튀김, 가격: 정보 없음 | 명: 명:비빔냉면, 가격: 정보 없음 | 명: 명:물냉면, 가격: 정보 없음 | 명: 명:만두, 가격: 정보 없음 | 명: 명:돈까스, 가격: 정보 없음 | 명: 명:해장국, 가격: 정보 없음 | 명: 명:감자탕, 가격: 정보 없음 | 명: 명:간장뼈찜, 가격: 정보 없음 | 명: 명:콩나물뼈찜, 가격: 정보 없음","2024.08.26.: 감자탕에서우리나라 탑 ! | 2024.08.04.:  | 2024.03.14.: 맛있음 ᆢ | 2023.10.13.: 감자탕 맛있게 잘 먹었어요!! | 2023.02.09.: 너무 맛있음! 꼭 와보시고 왜 여기집 리뷰에 악플 달음?찐으로 맛있음!나중에 비행기 타서 또 올거임!돈이 아깝지 않당-뼈다귀 해장국! 우거지 장난아니게 맛있음!고기가 사르르 녹음!!-돈까스!밥 하트 찐 귀엽~♡ 오 맛있는뎅!!이맛에 7,000원 무엇??? 너무 맜있엉!! | 2023.01.24.: 김치랑 깍두기가 맛있고 위생적입니다메뉴도 맛있어요 볶음밥도 누룽지해서 먹으면..굿 | 2023.01.11.:  | 2022.09.28.: 서울의 조마루와 다른맛이지만 김치와 깍두기가 맛남.... | 2022.09.22.: 맛없음 | 2021.10.26.:  | 2021.04.10.: 지금 장난치냐? 어이가 없어서.. | 2021.03.19.: 고기 퍽퍽해요 | 2020.09.16.: ",일치
영미,한식,"월,일요일","#노포, #제로페이, 더보기","예약불가, 포장가능",주차시설 없음,정보 없음,34,4.4점,"명:우족탕, 가격: 13,000 | 명:꼬리탕, 가격: 20,000 | 명:도가니수육, 가격: 35,000 | 명:육회, 가격: 30,000 | 명:소머리수육, 가격: 35,000 | 명:목뼈탕, 가격: 15,000 | 명:도가니탕, 가격: 15,000 | 명:꼬리, 가격: 45,000 | 명:도가니, 가격: 35,000 | 명:우족, 가격: 35,000 | 명:꼬리찜, 가격: 60,000 | 명:등골, 가격: 18,000 | 명:간/천엽, 가격: 15,000 | 명:모듬, 가격: 20,000 | 명:육사시미, 가격: 30,000","2024.08.03.:  | 2024.07.29.: 도가니탕, 꼬리탕 먹었고 맛은 괜찮았습니다. 다만 뚝배기가 너무 오래되고 삭아서 곳곳에 벗겨지고 있고, 밥이 담긴 소쿠리도 영 상태가 안 좋아.. 몸보신 되는게 아니라 몸에 해가 되는걸 먹고 있는 느낌이었습니다. | 2024.07.27.: 반반수육 너무 맛있어요! 소머리 수육이 입에서 녹음 ㅠㅠ 그래서 추가함!!!!!!꼬리곰탕도 부드럽고 맛있어요~ 그냥 다 맛있는것 같아요! 조만간 또 갈거에요💜 | 2024.07.16.: 반반수육 몸보신용으로 좋습니다. | 2024.06.12.: 헌지인 맛집...짱입니다. 다음에 또 방문하겠습니다. | 2024.05.05.:  | 2024.04.21.: 오픈시간맞춰서 갔는데도 사람 많았음,식사보다는 술에 먹기좋은 음식이에요~ 굳! | 2024.04.14.: 도가니 수육이 나쁘지 않네요. 국내산이 아니여서 조금은 아쉽지만 곰탕등의 메뉴도 매우 추천할만합니다. | 2024.04.03.: 도가니탕 먹었는데소 비린내 나요..국물에서도 고기에서도ㅍㅈ옥에 너무 길들어졌나봐요..맛집이라해서 갔는데 너무 실망했네요 | 2024.03.26.: 캬꼬리탕 인정혼자 밥 두공기 비우다 | 2024.03.16.: 끝내주내여! | 2024.03.11.: 맛있음. 잡내없고 깔끔하고. 수육 존맛임 양은 적은데 가격이 싼편이라 나쁘지않음. 또갈듯 | 2024.02.24.: 와 ○○○○ 꼬리찜은 저녁에만 가능 | 2024.02.22.: 소수육 강추꼭 드셔보세요 | 2024.02.21.: 도가니수육 폼 미쳐따잉? 웨이팅 없으면 좋을텐데. 오픈런 합시다. | 2024.01.05.: 너무 맛있네요ㅠ | 2023.12.31.: 평일점심에 혼자 가서 먹었는데 도민 어르신들 엄청 많이 오시더라구요도가니 좋아하는데 많이 들어있어요 국물은 정말 조금 시큼한 느낌이 있었는데 원래 그런 맛인지 모르겠고 맛있게 다 먹었어요밑반찬 콩나물 무침만 먹어봐도 맛있는게 사장님 내공 장난 아니신듯.. 삶은 배추같은거에 쌈장올려서 밥 싸먹는것도 완전 제 취향이었습니다ㅋㅋ도가니탕 | 2023.12.14.: 여름이라 그런지 간 상태가 안좋았고, 머리수육이 쉬기 전 상태인것 처럼 먹을 때 쉰내가 쫌 났습니다. 여름이라 그럴 수 있다 생각하고 날 선선해지면 다시 가볼 예정,. 국물은 맛있었어요노포라 화장실 예민한 분은 안가시는게..------------12.12.화 재방문 (별 2개에서 4개로 수정)겨울에 다시 갔습니다. 맛있습니다. 냄새 하나도 안나요.. 지방은 비린내 하나없이 꼬들해서 맛나네요. 저는 도가니보다 소머리가 좋아서 소머리수육, 목뼈탕, 사시미 주문했습니다( 등골은 이제 안한다네요) 겨울에는 최고의 안주인듯 합니다... 잘먹었습니다. | 2023.11.12.:  | 2023.09.17.: 비 오는 날에 생각이 나서 브레이크타임 끝나자마자 들어갔는데 순식간에 꽉 차더라구요 ,, 맛집 인정 -! 주차장은 따로 없습니다 골목에 해야해요 ㅜㅜ | 2023.09.13.:  | 2023.08.29.: 주차가 문제긴하지만 꼬리곰탕 맛있음 | 2023.08.08.: 주인이 바뀌었는지 몰라도 별하나도 아까움! | 2023.07.24.: 웨이팅이 어마어마 함반반 주문했는데 다음에는 소머리수육만 주문 예정양은 좀 적은듯전체적으로 지저분하며 매장 벽면이랑 화장실 좀 신경써야 함육수나온거 먹어보니 맛있지는 않네 | 2023.06.05.: 쏘주 그냥 들어가는 맛집! 소머리수육 드세요 | 2023.05.16.: 여기는 정말 저만 알고싶은 식당이네요 😂제주도 지인분들과 방문했는데 너무 맛있게 먹었습니다 너무 늦지 않은 저녁에 노포스러운 안주에 막걸리 한잔 하기 딱 입니다 추천드려요 👍 | 2023.05.15.:  | 2023.04.19.: @wuupick 이 보증합니다. | 2023.02.03.: 최고…🫶🏼 | 2022.12.18.:  | 2022.12.10.: 나만 알고싶은 곳 휴.. 존맛 | 2022.10.30.: 존맛존맛 | 2021.03.01.: 촤고입니다    술한잔하고 해장하고 갑니다 ^^ | 2020.09.29.: 최고!음식+사람이라생각하는데모두부합하는식당!또가고싶은데시간?",일치
류빈,"호프,요리주점",매일18:00 ~ 01:00,정보 없음,정보 없음,정보 없음,정보 없음,0,정보 없음,정보 없음,정보 없음,일치
